post_id,author,body,score,created_utc,date
17m7bun,huiafeather,I don't live in Riga (traveling there soon). On AirBnB experiences there are [some listed](https://www.airbnb.co.nz/s/Riga--Latvia/experiences?tab_id=experience_tab&amp;refinement_paths%5B%5D=%2Fexperiences%2FKG%2FTag%3A435).,1,1699923771.0,2023-11-14 01:02:51
17lyc69,Pastkaste,https://www.facebook.com/events/1455072225038074,1,1699022927.0,2023-11-03 14:48:47
17imjui,-Afya-,"No, we only do exchange with potatoes",6,1698525839.0,2023-10-28 20:43:59
17imjui,ro4ers,"Of course. Cards are preferred, actually.",1,1698525704.0,2023-10-28 20:41:44
17imjui,datamonkey08,99% of business use cards. Can't really remember the last time I used cash other than to tip someone. And most of the time I just use Applepay and don't even get my card out my wallet.,1,1698581636.0,2023-10-29 12:13:56
17imjui,weedexperts,You only need cash if you want to go to the market and even then some vendors do have cards these days. 99% you can purchase using card.,1,1698602511.0,2023-10-29 18:01:51
17hs1l9,Preston7777,"Add riga.neighborhood on instagram amd scroll through their posts, you’ll get the info you need",1,1698611197.0,2023-10-29 20:26:37
17h3if4,[deleted],Bolt app taxi. Should be around 15 eur.,3,1698346549.0,2023-10-26 18:55:49
17h3if4,Gnarlakx,Thank you,1,1698390831.0,2023-10-27 07:13:51
17ep2e1,yung_lank,"You can try calling Folkklubs Ala, they could probably split you into a few groups if you don’t mind. Not on a weekend though.",2,1698126019.0,2023-10-24 05:40:19
17ep2e1,rwrandom,Thank you!,1,1698152347.0,2023-10-24 12:59:07
17ep2e1,Dagadags,Andaluzijas suns,2,1698152031.0,2023-10-24 12:53:51
17ep2e1,Dagadags,Or Lido alus sēta in old town,2,1698152135.0,2023-10-24 12:55:35
17ep2e1,rwrandom,Thanks again!,1,1698152369.0,2023-10-24 12:59:29
17ep2e1,rwrandom,Thank you!,1,1698152360.0,2023-10-24 12:59:20
17ep2e1,[deleted],[deleted],2,1698166652.0,2023-10-24 16:57:32
17ep2e1,rwrandom,Thank you!,1,1698174167.0,2023-10-24 19:02:47
17dzgoj,exemon,TAKA Spa and ESPA.,2,1698051047.0,2023-10-23 08:50:47
17dzgoj,sarukuku,"Perfect, thank you!",1,1698612165.0,2023-10-29 20:42:45
17d66pk,[deleted],"No, idea what that place is from the other guy.  Basically, u have 4 major nightlife ares :  1. Old Town tourists drunky bars - Google maps: ROCK CAFE and all venues around it in 200-500m  2. Poshy clubby by the river - Google maps: KOYA lounge and all the venues around it in 100m  3. Alternative modern clubby youth: Google maps: M-DARBNICA and all the venues around it 50m  4. Same but different arty youth area with bars/clubs - Google maps: TALLINAS PAGALMS  I would try 3-4. They are pretty close to each other.  PS: just fully read your post, definitely start with TALLINAS PAGALMS -the is food court and all what u looking for I'm the radius of 200m lol GO EXPLORE",6,1697912247.0,2023-10-21 18:17:27
17d66pk,lukeh6227,"That's amazing -  Tallinas Pagalms has come up repeatedly elsewhere too, so we're about to go check it out! We did manage to have some really good food and nice beer in Folkklubs Ala, but looking forward to getting out and seeing some more of the ""real"" city. You guys are so lucky to live here!",2,1697915692.0,2023-10-21 19:14:52
17d66pk,Cyxoi,"If you you will go to the Tallinas pagalms, Kupinatava is a must to visit for a great food. Amazing smoked meat. https://maps.app.goo.gl/mUBHn3Ag95QQLrks9?g_st=ic",1,1697958023.0,2023-10-22 07:00:23
17d66pk,[deleted],That is not one of the great bars nearby.   Go further afield.,4,1697905626.0,2023-10-21 16:27:06
17d66pk,lukeh6227,Tips???,1,1697906606.0,2023-10-21 16:43:26
17d66pk,rakereha,https://maps.app.goo.gl/gSmvCA6nS3AuGJW28,0,1697907531.0,2023-10-21 16:58:51
17bi1j6,irirriri,"Mārtiņa beķereja - not a restaurant, but a bakery. There's at least 3 locations, one of those is in the Old Town. Great prices, decent quality and always filled with elderly locals!",3,1697720835.0,2023-10-19 13:07:15
17bi1j6,irirriri,"Another local classic that has been open since the 90's is Lauvas nams, which is a traditional meat-and-potatoes kind of bistro that is open all night. There is a police station and also some clubs and bars nearby, so it's not unusual to see cops and ravers pleasantly dining nearby at 3 am. Lovely and patient staff as well.",3,1697739483.0,2023-10-19 18:18:03
17bi1j6,Tiny_Capital_9777,Thank you for these suggestions I will definitely be checking them out!,1,1697745252.0,2023-10-19 19:54:12
17bi1j6,[deleted],"I’m not that elderly yet, more middle aged, but already I’m always in Mārtiņa Beķereja.",1,1697748744.0,2023-10-19 20:52:24
17bi1j6,caucasian_asian,"3 men in a boat.. it's a bar, but there a few elderly locals here now. Great food",3,1697722072.0,2023-10-19 13:27:52
17bi1j6,irirriri,"Might be easier to google by its Latvian name, 3 vīri laivā, but this is a good one - traditional Latvian bar food, decent beer, a middle- aged men's sport's bar that's been there since forever. Also a lot of other bars and liveliness in close vicinity",2,1697739010.0,2023-10-19 18:10:10
17bi1j6,Tiny_Capital_9777,"This sounds great, thank you!",1,1697745235.0,2023-10-19 19:53:55
17bi1j6,[deleted],Definitely try out bistro Vistinas on Matīsa street 32. Cash only for payments there,3,1697773175.0,2023-10-20 03:39:35
17bi1j6,Tiny_Capital_9777,"Amazing, thank you!",1,1697787777.0,2023-10-20 07:42:57
17bi1j6,exclaim_bot,"&gt;Amazing, thank you!  You're welcome!",1,1697787798.0,2023-10-20 07:43:18
1780k50,bilkims,In EU those are banned.,5,1697323419.0,2023-10-14 22:43:39
1780k50,tuncay06_,Reason?,1,1697327142.0,2023-10-14 23:45:42
1780k50,118shadow118,"To make cigarettes less attractive (was gonna say to young people, but actually in general)",2,1697347330.0,2023-10-15 05:22:10
1732ek2,Worse_Username,"Yet, it is coming",1,1696789499.0,2023-10-08 18:24:59
17223fq,Herubeleg,deep,1,1696848603.0,2023-10-09 10:50:03
170w3nz,No_Fruit5795,"You can go to sporta naums on weekends and join any random team but , I am afraid the weather won't allow you",1,1696732920.0,2023-10-08 02:42:00
170w3nz,No_Fruit5795,It is in Tallinas where you can find yhe the skate parks and bb courts,1,1696732960.0,2023-10-08 02:42:40
170ik75,No_Fruit5795,Lido,1,1696733089.0,2023-10-08 02:44:49
170fiiy,MazaisNeptuns,No,3,1696586639.0,2023-10-06 10:03:59
170fiiy,Significant-Ad6488,:/,1,1696593371.0,2023-10-06 11:56:11
170cn02,Impossible_Plant7608,Any luck?,1,1727873209.0,2024-10-02 12:46:49
170cn02,damnnagla,dm,1,1734131789.0,2024-12-13 23:16:29
170cn02,Llama_san,@SnusSpotEU,1,1738523848.0,2025-02-02 19:17:28
170cn02,Herubeleg,"Use facebook market, it is better, or Andele Mandele. Telegram is full of bots for these type of groups in Riga and the only selling groups you'll find will not be exactly for legal stuff.",0,1696496601.0,2023-10-05 09:03:21
16yzjbc,[deleted],"Try news org Meduza based in Riga, setup by ex RU journalists.  The semi-official motto is ""Make the Kremlin sad"".",3,1696359035.0,2023-10-03 18:50:35
16yzjbc,effrum,Thanks! I've sent them an email but no response yet 😕,1,1696359070.0,2023-10-03 18:51:10
16ypmpm,exemon,Croissants and canelés from Kukotava,2,1696335661.0,2023-10-03 12:21:01
16ytmpe,Comfortable_Home5710,"Old town is full of bars and clubs that usually close at 4-6am, plenty of things to do :)",1,1696605628.0,2023-10-06 15:20:28
16y6pi4,[deleted],"Great party in Czechia, I hear.",5,1696279175.0,2023-10-02 20:39:35
16y6pi4,yung_lank,"There are a ton of clubs in Maskačka! When someone yells at you in Russian, you have to respond with the secret password “Pashul Nahuj” and they will let you in. Super underground.",-1,1696312857.0,2023-10-03 06:00:57
16y6pi4,Herubeleg,Armory  Aussie Pub  Depo  Clayton McNamaras Drinking Emporium  Valhala  Ala folklub  Pandemonium  Riga Rockcafe  Fox bar  Ezitis Migla  Sinners Club  Kiwi bar  Piana Vyshnia  O'paps  Alus Nr 1  take trolley 25 and go to Labietis  cross the street and go to Tallinas Kvartals.  &amp;#x200B;  Finish your night there.,1,1696331109.0,2023-10-03 11:05:09
16y6pi4,Loud-Supermarket-908,What is the best? My friends and I'll spend just 2 nights in Riga. The last one is close to the hotel... Thanks.,1,1696529213.0,2023-10-05 18:06:53
16y6pi4,Herubeleg,Just go to Tallinas Kvartals. There is a bit of everything there and you'll sure find your kind of vibe.,2,1696575193.0,2023-10-06 06:53:13
16xyryg,[deleted],I’m sure Radisson CEO Federico González will be along shortly to enlighten us.,1,1696278517.0,2023-10-02 20:28:37
16xyryg,weedexperts,There's a very long but fascinating story filled with intrigue and plot twists in the history of Radisson in Riga. Too long for a Reddit post. Maybe someone will write a book about it one day.,1,1696332689.0,2023-10-03 11:31:29
16wt6wc,ro4ers,"Barents if you like seafood. I'd say that atm it's the top restaurant in Riga. Max Cekot, a runner-up, with [3 Pavari/3 chefs](https://www.3pavari.lv/en/menu) taking a third.   In an unlucky coincidence, the first Michellin guide for Riga will be released at the end of November",5,1696145588.0,2023-10-01 07:33:08
16wt6wc,lodzinjsh,this.,2,1696202027.0,2023-10-01 23:13:47
16wt6wc,Pastkaste,"Restaurants: Max Cekot, Snatch, 3 chefs. Also check out topjaw Riga guide on youtube.",3,1696144982.0,2023-10-01 07:23:02
16wt6wc,[deleted],Was about to suggest Vincents where I had many good dinners out for special occasions.   https://www.restorans.lv/about-3  But I see it’s just closed permanently. Šausmīgs!,2,1696153191.0,2023-10-01 09:39:51
16wt6wc,TheDreadPirateJeff,"UPDATE: Just wanted to thank everyone for the suggestions...  I decided to get a reservation at Barents and also at Restaurant John, but I think we're also going to try to hit up Snatch, it looks delicious too, but we'll have to see what time allows.    I was really interested in taking her to Max Cekot Kitchen, but they are booked during the time we'll be there together. Though they have some openings the week before when I'm there alone for work, so I may see about getting a table for 1 and go myself, because that looked fantastic too.",1,1697430503.0,2023-10-16 04:28:23
16wt6wc,xiaobao12,"OP, how was Snatch? I look forward to hearing your experience!!",1,1722131897.0,2024-07-28 01:58:17
16wt6wc,darknmy,"Google maps - check menu, location and reviews",1,1696179060.0,2023-10-01 16:51:00
16wt6wc,plagymus,Lauvas nams,0,1696160197.0,2023-10-01 11:36:37
16wt6wc,19marcel96,Hey man. I’m going to Riga at the end of march. Already booked Barents and Max Cenkot. You got any other recs?,1,1705523361.0,2024-01-17 20:29:21
16wt6wc,TheDreadPirateJeff,"Barents was very good. I didn't get a chance to try Max Cekot as they were booked solid by the time I tried making reservations.  We also went to Restaurant John and it was quite good too.  They were pretty nice. It was Riga Restaurant Week and we didn't want their set course (which was a sampler, we wanted a full meal), and they warned us that ordering from the menu would take a while.  It did take a while, but was well worth the wait. Also, because we were so patient, we ended up with a free drink and free desert. The service was fantastic at both.  But what else are you looking for?  [Riviera](http://rivierarestorans.lv/en/) was also really good, as was [FERMA](https://fermarestorans.lv/lv/).    Theres a LOT of good, inexpensive food too.  [Tinto](https://www.tinto.lv/english) was a nice little quiet wine bar with a limited menu that was a nice change of pace for a quiet dinner.  LIDO is cheap, cafe style Latvian. The quality is good, the price fantastic.   This comes up as [Rockabilly House](https://maps.app.goo.gl/8TWjfJc6WqN49m3D9) on Google Maps, but when went it was called ""The Stage by Two More Beers"" had a good beer selection and I very much enjoyed the burgers.  Mīkla Bakeries (there are several) makes some great pastries and coffee. And there are a lot of good coffee shops all over central Riga and Old Town.  Another cozy Latvian place we liked (and went to twice) was [Province](https://www.provincija.lv/en/)",1,1705525856.0,2024-01-17 21:10:56
16wt6wc,19marcel96,"Thank you! I’ll be staying at A22 where John is located, so might have to give it a try! Just looking for a little bit of everything, so this was really helpful. Thanks!",1,1705528336.0,2024-01-17 21:52:16
