post_id,author,body,score,created_utc,date
1k9ogaa,maclex,\+++ Respect 👌,2,1745840438.0,2025-04-28 11:40:38
1k958wk,Inside-Package-8151,"Search for D&amp;D Cauldron in Instagram or Facebook. Mostly they play in Russian, but it's a big community, so I think they will find someone who is ready to play in English.",1,1746255189.0,2025-05-03 06:53:09
1k35wx7,Lamafuxker,Why? Because you are creep? Any info?,21,1745097335.0,2025-04-19 21:15:35
1k35wx7,xdox123,"Why? Try to ask person who sent you this photo or contact website where you downloaded it. It might be from anywhere in world, not just in this country.",11,1745104887.0,2025-04-19 23:21:27
1k35wx7,Kriks4,"@loginblogin your story does not check out. Skechy vibes. It seems that you don't hold the original  image file and the photographer would not respond to your queries.   I would advise clearing up why do you intend to find this location.  Also, as a rule of thumb, I would sincere recommend everyone to defer from providing precise living area locations on the web.",4,1745317659.0,2025-04-22 10:27:39
1k35wx7,Kriks4,"On that note. Seeing your posting history, i am not encouraged to think that you are a reliable internet denizen.",1,1745317766.0,2025-04-22 10:29:26
1k35wx7,AnonymousBoomer,Nekas mani nevarēja sagatavot tam post history 💀💀💀,1,1745515764.0,2025-04-24 17:29:24
1k35wx7,loginblogin,I think you’re taking things a bit too seriously :),1,1745532339.0,2025-04-24 22:05:39
1k35wx7,_DarKneT_,"If what you have is the original picture, look up the metadata for geo info",3,1745131545.0,2025-04-20 06:45:45
1k35wx7,loginblogin,That would be way too easy :),-2,1745140072.0,2025-04-20 09:07:52
1k35wx7,theorists-notreal,Ima guess Tomsona iela 34.   :p,1,1745167230.0,2025-04-20 16:40:30
1k35wx7,loginblogin,That doesn’t seem right at all),1,1745168147.0,2025-04-20 16:55:47
1k35wx7,theorists-notreal,"I reversed imaged it, first thing that Poped up was Tomsona iela 34 (or used Google lens)",1,1745171302.0,2025-04-20 17:48:22
1k35wx7,martins_gr,"I think you can see tram tracks there, so can be Miera street as well.",1,1745217330.0,2025-04-21 06:35:30
1k35wx7,loginblogin,"The horizontal lines are part of the fence, I think. Besides, Miera Street is too wide.",1,1745218281.0,2025-04-21 06:51:21
1k35wx7,Jaisonkrid,Look like Simtgades aleja 3 where was some cafe(1 year or more ago) near tennis court.,1,1745314209.0,2025-04-22 09:30:09
1k35wx7,IntelligentPrize5634,"Agenskalns, this building is near Sunday market Kalnciema market  This place is yard of apartment building. I’m a bolt courier I recognize this place.",1,1745341074.0,2025-04-22 16:57:54
1k35wx7,loginblogin,I’ve driven all around using Google Car but I can’t find this place. Can you share a map link?,1,1745532125.0,2025-04-24 22:02:05
1k35wx7,loginblogin,The author of the photo says that you need to look on the other side of the river.,1,1745563562.0,2025-04-25 06:46:02
1k35wx7,Cyxoi,"It gives me Āgenskalns vibes, but might be wrong. Anyway, nothing more precise",1,1745128935.0,2025-04-20 06:02:15
1k35wx7,loginblogin,The photographer says there's a market nearby. There's definitely no forest around,-1,1745169436.0,2025-04-20 17:17:16
1k35wx7,Cyxoi,"Ok, then there are two options - Agenskalna market or Kalnciema market. I tried to walk around on Google maps, but couldn’t find anything",1,1745180391.0,2025-04-20 20:19:51
1k35wx7,loginblogin,I didn't find a single similar fence around(,1,1745181222.0,2025-04-20 20:33:42
1k3bpad,001Piffi,"Don't do student dorms. Check out Facebook Groups. Also, don't stress yourself. If you have the option, rent an apartment at Youthments for example for a month and search for apartments during September. Most of the cheap apartments get posted either really early on or in September. But it's really not hard to find an apartment.",2,1745136781.0,2025-04-20 08:13:01
1k3bpad,TowardsToFlames,"As I said, I prefer the dormitory for the socialization. Also, if I rent an apartment, do you think 300 euros will be enough for bills and rent?",1,1745144169.0,2025-04-20 10:16:09
1k3bpad,Financial-Profit6108,Rent an apartment with your friend?,2,1745115021.0,2025-04-20 02:10:21
1k3bpad,TowardsToFlames,"Its gonna be my first year. So, i dont have any.",1,1745143956.0,2025-04-20 10:12:36
1k3bpad,GGGMMM27,"I think that in some of the RTU dorms, the bathroom/toilet is shared between just two rooms — like in a small hallway between them — so it's not that bad. But I believe this setup is only in the newer dorms in Ķīpsala, if I'm not mistaken.  Also, as someone already mentioned here, check out Facebook groups — when the semester ends, people often post room rental offers. However, keep in mind that sometimes the price can be almost the same as renting a whole apartment in another area.  You can also make your own post saying that you're looking for flatmates and want to share an apartment with someone.  This website is useful for checking apartment prices in different areas:   [https://www.ss.lv/lv/real-estate/flats/riga/filter/](https://www.ss.lv/lv/real-estate/flats/riga/filter/)  Edit: ff you look at the list, quite a few rooms in the RTU dorms actually have their own WC and even a shower. However, one of the most important questions will be how accessible and available these facilities are.",2,1745487728.0,2025-04-24 09:42:08
1k3bpad,Fabulous_Tune1442,You can find many slums for much less than 300€. But you’ll have to endure indians who blast music until 3 am every day.,0,1745175509.0,2025-04-20 18:58:29
1k20d1o,Even_Method_8719,"Google Riga hostels to find cheap accommodations, but outside of that, what you want to do depends on your interests.  Riga is known for its architecture -- dating back to the early 12th century in the Old Town, lots of Art Nouveau.  You'll be here in June, so theaters, the opera and such will be closed for the summer, but should you be here June 23, find yourself a Latvian, attach yourself to his or her hip and go to a traditional Summer solstice celebration.  Key elements:  Campfire and lots of beer.  We have a nice zoo, if that's your thing.  You can take boat rides on the river.  At the top of the Radisson Blu hotel is a bar with magnificent views all around town.  In other words, lots to do, and I hope you have a great time!",1,1744972150.0,2025-04-18 10:29:10
1k2br4s,aidannulty,Riga great place. Don't be too loud or mouthy when you out drinking.,7,1745006437.0,2025-04-18 20:00:37
1k2br4s,Affectionate-Dog8237,Ok Great :) other advice? :),1,1745009405.0,2025-04-18 20:50:05
1k2br4s,Interesting_Agent269,"Riga is a fabulous place to go. Amazing city, lots of fun, great beer and food. Just be careful of women, who may be out of your league, approaching you in bars (especially Old Town). I have had two separate foreign male friends get their credit cards stolen/ charged at the bars for hundreds of dollars and one of them was drugged. If it seems too good to be true, it probably is.   Ala Pagrabs is my go to spot for authentic food and beer. Tallinas Kvartals is an area outside of the Old Town that is usually very popular for bars and hanging out during summer. Nearby to that is One One which may have the electronic vibe youre going for.",3,1745019768.0,2025-04-18 23:42:48
1k2br4s,AlternativeFluffy310,"Well about your friends - that sucks but also some common sense should be used.. that applies to any country ever. Scammers are everywhere, basic travel/life advice :) Travellers always must use extra caution everywhere. But this story is definitely not an often occurrence and it is absolutely safe and shouldn't scare anyone off.",2,1745048147.0,2025-04-19 07:35:47
1k2br4s,Affectionate-Dog8237,"Yes clearly, I've heard a lot of stories about that too. Girls in bars, strip clubs, etc.  It's a bit scary, but as u/AlternativeFluffy310  says, it's pretty much the case everywhere, but I've heard more about eastern cities, that's for sure :/ It doesn't put you in the best mood to have to be careful all the time and to have doubts.   Let's hope it happens less often now \^\^",1,1745061753.0,2025-04-19 11:22:33
1k2br4s,Interesting_Agent269,"I’m a female, I lived in Riga for a year and never had any issues. My friends were dumb of course but that’s the thing to be aware of if you’re gonna go for a boys holiday with any bit of excessive drinking. Use good judgement and caution and you’ll be fine but just warning that it is a possibility! Like I said, I love Riga and think it’s a great place to go!",1,1745067789.0,2025-04-19 13:03:09
1k2br4s,Affectionate-Dog8237,Ok Great :) Thanks a lot for this warning :) Do you have any other advice? Place to go? Party to have fun?   Thanks 🙏🏻,1,1745069229.0,2025-04-19 13:27:09
1k2br4s,Interesting_Agent269,"If you want a day trip out of the city, Jurmala is a popular beach town with lots of restaurants. I prefer the quieter Vecaki beach area on the other side of Riga. As well, Sigulda is nice for hiking but a bit farther. These are all easily reachable via train.  In Riga, the cafe culture is lovely and ever growing. There are tons of amazing pastries and cakes as well. Old Town is the go to tourist area but walking around the Quiet Center and general Centrs area is great.   Old Town and Tallinas Kvartals are your most popular bar areas for tourists, with a few club type vibes for each (you will easily be able to spot them at night time). You might want to check out Laska V21 if you want to switch it up, they might have some type of concert or rave while youre there. For a bit classier, Gimlet Nordic Cocktail Bar is nice and you might meet more locals there.",1,1745069809.0,2025-04-19 13:36:49
1k2br4s,Party-Expression4849,Mangalsala has the best techno parties ever,8,1745001086.0,2025-04-18 18:31:26
1k2br4s,Affectionate-Dog8237,Ok Nice Thanks :) it’s hard to find information about this place 😅,1,1745009566.0,2025-04-18 20:52:46
1k2br4s,AlternativeFluffy310,"You are joking, right?",1,1745047045.0,2025-04-19 07:17:25
1k2br4s,Affectionate-Dog8237,"https://preview.redd.it/04e5gbe20sve1.png?width=2547&amp;format=png&amp;auto=webp&amp;s=22e171be50948f250c663cbf947f12817698ce60  Nope, I can't find much information online about next party\^\^",1,1745061609.0,2025-04-19 11:20:09
1k2br4s,AlternativeFluffy310,"Whoops, i meant to u/Party-Expression4849 to ask this. It really isnt a nice area for tourists, as a local even i avoid (unless going by the sea) and i believe there isnt a thing like that. Weird its also upvoted :D",1,1745083549.0,2025-04-19 17:25:49
1k2br4s,AlternativeFluffy310,"Where are you from? Might be easier to answer knowing that.  I just find it odd that someone would ask if a capital of 800 mil (or so) has fun/nice people. No offense. :D  About people feeling cold - just view it as a northern country thing, little bit colder at first to strangers but warm little teddy bears when you get to know them. Party settings are different though, people are much more open.",1,1745047706.0,2025-04-19 07:28:26
1k2br4s,Affectionate-Dog8237,"We are from south of France\^\^ If it can help you :)  Yes, I suppose so \^\^ but let's just say that some cities are more fun than others. Ibiza, for example, has a small population but it's a lot of fun, like Berlin.   And as I don't know Riga, I was wondering whether it might not be the best choice for us \^\^.    Ok I see :) Thanks   Indeed, I went out with a Russian so I understand very well what you mean \^\^    Yes, since we won't be here long, I hope we'll find some nice people to party with :)",2,1745061474.0,2025-04-19 11:17:54
1k2br4s,AlternativeFluffy310,"Ah, you guys should have fun then. No worries. Much safer also than Paris. :D and people are nicer generally than French are (from my totally subjective experience in France). Enjoy!",1,1745083402.0,2025-04-19 17:23:22
1k2br4s,Affectionate-Dog8237,Haha I Hope so :)  From your expérience With parisian right? ^^ they are Clearly not nice ^^ i avoid Paris every Time I can ^^,2,1745092345.0,2025-04-19 19:52:25
1k2br4s,[deleted],[removed],-1,1745000449.0,2025-04-18 18:20:49
